{
  "$schema": "https://json-schema.org/draft/2020-12/schema",
  "title": "business-areas library item",
  "type": "object",
  "required": [
    "category",
    "icon",
    "id",
    "locales",
    "order",
    "verified",
    "version"
  ],
  "properties": {
    "category": { "type": "string" },
    "icon": { "type": "string" },
    "id": { "type": "string" },
    "integrations": { "type": "array" },
    "locales": { "type": "object" },
    "order": { "type": "integer" },
    "popular": { "type": "boolean" },
    "recommended": { "type": "object" },
    "type": { "type": "string" },
    "verified": { "type": "boolean" },
    "version": { "type": "integer" }
  },
  "additionalProperties": true
}
