{
  "id": "purchasing",
  "version": 1,
  "type": "domain",
  "category": "buy_make",
  "icon": "case",
  "order": 60,
  "popular": true,
  "integrations": [
    "Xentral"
  ],
  "recommended": {
    "skills": [
      {
        "id": "reorder_proposal",
        "label": "Bestellvorschlag"
      },
      {
        "id": "framework_contracts",
        "label": "Rahmenverträge"
      },
      {
        "id": "dropshipping",
        "label": "Dropshipping"
      }
    ],
    "agents": [
      {
        "id": "procurement_meta_agent",
        "label": "Beschaffung"
      }
    ],
    "workflows": [
      {
        "id": "low_stock_reorder_proposal",
        "label": "Niedrigbestand → Bestellvorschlag"
      }
    ],
    "dashboards": [
      {
        "id": "purchasing",
        "label": "Einkauf"
      }
    ],
    "pdf_templates": [
      {
        "id": "bestellung_xentral_original",
        "label": "Bestellung"
      }
    ],
    "apps": [
      {
        "id": "bestellvorschlag",
        "label": "Bestellvorschlag"
      }
    ],
    "also": {}
  },
  "locales": {
    "de": {
      "name": "Purchasing",
      "description": "Bedarf → Bestellung → Wareneingang → Eingangsrechnung. Alles rund um Procure-to-Pay."
    },
    "en": {
      "name": "Purchasing",
      "description": "Demand → order → goods receipt → supplier invoice. Everything Procure-to-Pay."
    }
  },
  "verified": false
}
