{
  "id": "inventory_warehouse",
  "version": 1,
  "type": "domain",
  "category": "store_ship",
  "icon": "box",
  "order": 80,
  "popular": true,
  "integrations": [
    "Xentral"
  ],
  "recommended": {
    "skills": [
      {
        "id": "stocktaking",
        "label": "Inventur"
      },
      {
        "id": "pick_app",
        "label": "Pick App"
      },
      {
        "id": "pick_runs",
        "label": "Pickläufe"
      },
      {
        "id": "branch_delivery",
        "label": "Filiallieferung"
      }
    ],
    "agents": [
      {
        "id": "daily-logistics-briefing",
        "label": "Tägliches Logistik-Briefing"
      }
    ],
    "also": {
      "pdf_template": [
        {
          "ref": "pick_list",
          "label": "Pickliste"
        },
        {
          "ref": "picking_slip",
          "label": "Kommissionierschein"
        },
        {
          "ref": "pallet_label",
          "label": "Palettenetikett"
        },
        {
          "ref": "item_labels",
          "label": "Artikeletiketten"
        }
      ],
      "dashboard": [
        {
          "ref": "warehouse_shipping",
          "label": "Lager & Versand"
        },
        {
          "ref": "logistics",
          "label": "Logistik"
        }
      ]
    }
  },
  "locales": {
    "de": {
      "name": "Inventory & Warehouse",
      "description": "Bestände, Kommissionierung, Inventur und Umlagerungen im Lager."
    },
    "en": {
      "name": "Inventory & Warehouse",
      "description": "Stock, picking, stocktaking and transfers in the warehouse."
    }
  },
  "verified": false
}
