{
  "id": "master_data",
  "version": 1,
  "type": "domain",
  "category": "steer",
  "icon": "tag",
  "order": 120,
  "popular": false,
  "integrations": [
    "Xentral"
  ],
  "recommended": {
    "skills": [],
    "agents": [
      {
        "id": "product-desc",
        "label": "Produkttexte"
      },
      {
        "id": "daily-products-briefing",
        "label": "Tägliches Produkt-Briefing"
      }
    ],
    "workflows": [
      {
        "id": "catalog_data_quality_sweep",
        "label": "Datenqualitäts-Sweep"
      }
    ],
    "dashboards": [
      {
        "id": "master_data",
        "label": "Stammdaten"
      }
    ],
    "pdf_templates": [],
    "apps": [],
    "also": {
      "connection": [
        {
          "ref": "akeneo",
          "label": "Akeneo"
        },
        {
          "ref": "plytix",
          "label": "Plytix"
        }
      ]
    }
  },
  "locales": {
    "de": {
      "name": "Product & Master Data",
      "description": "Artikel, Preise, Kategorien und Kundenstammdaten sauber gepflegt."
    },
    "en": {
      "name": "Product & Master Data",
      "description": "Articles, prices, categories and customer master data kept clean."
    }
  },
  "verified": false
}
