{
  "id": "finance",
  "version": 1,
  "type": "domain",
  "category": "steer",
  "icon": "invoice",
  "order": 100,
  "popular": true,
  "integrations": [
    "Xentral"
  ],
  "recommended": {
    "skills": [
      {
        "id": "collective_invoice",
        "label": "Sammelrechnung"
      },
      {
        "id": "progress_invoice",
        "label": "Abschlagsrechnung"
      }
    ],
    "agents": [
      {
        "id": "finance_incoming_invoice",
        "label": "Eingangsrechnung"
      },
      {
        "id": "finance_incoming_payment_advice",
        "label": "Zahlungsausgleich"
      }
    ],
    "also": {
      "workflow": [
        {
          "ref": "daily_opos_digest",
          "label": "Täglicher OPOS-Digest"
        },
        {
          "ref": "opos_dunning_escalation",
          "label": "Mahn-Eskalation"
        }
      ],
      "pdf_template": [
        {
          "ref": "rechnung_xentral_original",
          "label": "Rechnung"
        },
        {
          "ref": "gutschrift_xentral_original",
          "label": "Gutschrift"
        }
      ],
      "dashboard": [
        {
          "ref": "finance",
          "label": "Finanzen"
        }
      ],
      "connection": [
        {
          "ref": "datev",
          "label": "DATEV"
        },
        {
          "ref": "lexoffice",
          "label": "lexoffice"
        },
        {
          "ref": "sevdesk",
          "label": "sevdesk"
        }
      ]
    }
  },
  "locales": {
    "de": {
      "name": "Finance",
      "description": "Debitoren, Kreditoren, offene Posten, Mahnwesen und Zahlungsabgleich."
    },
    "en": {
      "name": "Finance",
      "description": "Receivables, payables, open items, dunning and payment matching."
    }
  },
  "verified": false
}
