{
  "id": "reporting_controlling",
  "version": 1,
  "type": "domain",
  "category": "steer",
  "icon": "chart",
  "order": 110,
  "popular": false,
  "integrations": [
    "Xentral"
  ],
  "recommended": {
    "skills": [],
    "agents": [
      {
        "id": "cockpit-kpi-writer",
        "label": "Cockpit-KPI-Autor"
      },
      {
        "id": "daily-cockpit-briefing",
        "label": "Tägliches Cockpit-Briefing"
      },
      {
        "id": "quick-cockpit-now",
        "label": "Cockpit jetzt (schnell)"
      }
    ],
    "also": {
      "dashboard": [
        {
          "ref": "ceo_overview",
          "label": "CEO-Überblick"
        },
        {
          "ref": "performance_controlling",
          "label": "Performance-Controlling"
        },
        {
          "ref": "agent_performance",
          "label": "Agenten-Performance"
        }
      ]
    }
  },
  "locales": {
    "de": {
      "name": "Reporting & Controlling",
      "description": "KPIs, Dashboards und Auswertungen für den Überblick über den ganzen Betrieb."
    },
    "en": {
      "name": "Reporting & Controlling",
      "description": "KPIs, dashboards and analyses for an overview of the whole operation."
    }
  },
  "verified": false
}
