{
  "id": "customer_service",
  "version": 1,
  "type": "domain",
  "category": "sell_serve",
  "icon": "team",
  "order": 30,
  "popular": false,
  "integrations": [
    "Xentral"
  ],
  "recommended": {
    "skills": [],
    "agents": [
      {
        "id": "complaint-triage",
        "label": "Reklamations-Triage"
      },
      {
        "id": "daily-customer-service-briefing",
        "label": "Tägliches CS-Briefing"
      },
      {
        "id": "quick-cs-pulse",
        "label": "CS-Puls (schnell)"
      }
    ],
    "also": {
      "dashboard": [
        {
          "ref": "customer_service",
          "label": "Kundenservice"
        },
        {
          "ref": "inbox_triage",
          "label": "Inbox-Triage"
        }
      ]
    }
  },
  "locales": {
    "de": {
      "name": "Customer Service",
      "description": "Anfragen, Reklamationen und SLA-Kommunikation an einem Ort gebündelt."
    },
    "en": {
      "name": "Customer Service",
      "description": "Inquiries, complaints and SLA communication bundled in one place."
    }
  },
  "verified": false
}
