{
  "id": "marketing_crm",
  "version": 1,
  "type": "domain",
  "category": "sell_serve",
  "icon": "megaphone",
  "order": 50,
  "popular": false,
  "integrations": [
    "Xentral"
  ],
  "recommended": {
    "skills": [
      {
        "id": "cross_selling",
        "label": "Cross-Selling"
      },
      {
        "id": "vouchers",
        "label": "Gutscheine"
      }
    ],
    "also": {
      "agent": [
        "CRM-Agent",
        "Kampagnen-Agent"
      ],
      "workflow": [
        "Lead-Nurturing",
        "Newsletter-Versand"
      ],
      "dashboard": [
        "Kampagnen & Leads"
      ]
    }
  },
  "locales": {
    "de": {
      "name": "Marketing & CRM",
      "description": "Kampagnen, Leads, Newsletter und Cross-/Up-Selling entlang der Kundenbeziehung."
    },
    "en": {
      "name": "Marketing & CRM",
      "description": "Campaigns, leads, newsletters and cross-/up-selling along the customer relationship."
    }
  },
  "verified": false
}
